<?xml version="1.0" encoding="UTF-8"?>
<fll title="Science of Speed: 2008"
 bracketSort="ALPHA_TEAM"
  winner='LOW'
 revision="$Rev: 351 $"
 xmlns:xsi="http://www.w3.org/2001/XMLSchema-instance"
 xsi:noNamespaceSchemaLocation="fll.xsd"
 >

  <Performance minimumScore="-20" weight="1.0">

  <goal name="seconds" title="Seconds" max="10"/>
  <goal name="tenths" title="Tenths" max="10"/>
  <goal name="hundredths" title="Hundreths" max="10"/>
  <goal name="thousandths" title="Thousandths" max="10"/>
  
  <tiebreaker>
  <!-- should be empty, but not allowed by the schema -->
   <test winner='LOW'>
     <term goal='seconds' scoreType='computed'/>
   </test>
  </tiebreaker>

 </Performance>

</fll>
